name,title,description,datatype,required
identifier,Ідентифікатор,Порядковий номер або будь-який інший ідентифікатор звіту. Наприклад: 01-123-2019-05-29.,string,true
dateAccepted,Дата ухвалення,Дата затвердження звіту у форматі ISO 8601 (рррр-мм-дд). Наприклад: 2018-07-06.,date,false
title,Назва,Назва звіту. Наприклад: Звіт про виконання програми розвитку позашкільної освіти на 2018—2021 роки за перше півріччя 2018 року.,string,true
periodStartDate,Початок періоду,"Початкова дата періоду, який охоплює звіт у форматі ISO 8601 (рррр-мм-дд). Наприклад: 2018-01-01.",date,true
periodEndDate,Кінець періоду,"Кінцева дата періоду, який охоплює звіт у форматі ISO 8601 (ррр-мм-дд). Наприклад: 2018-05-31.",date,true
programmeIdentifier,Ідентифікатор програми,"Ідентифікатор програми, щодо якої складений звіт, з колонки identifier таблиці Programs. Наприклад: 719-2019-05-29.",string,true
programmeTitle,Найменування програми,"Найменування програми, щодо якої складений звіт, з колонки title таблиці Programs. Наприклад: Програма розвитку позашкільної освіти на 2018—2021 роки.",string,true
url,Посилання,"Посилання на копію звіту, що оприлюднена в мережі Інтернет. Посилання має починатися з http:// або https://. Наприклад: https://www.example.gov.ua/example.doc.",anyURI,true